{
  "schema_version": "1.0",
  "delivery_id": "01j4w4k2q9d3n7h8xzjg5g5x2s",
  "consumer_id": "llm-wiki",
  "sequence": 1,
  "operation": "source_upsert",
  "idempotency_key": "page:01j4w4j6v2v4p84n8v7v60m0s7:version:01j4w4j7mr6c9s7cezz9n5f2qp:v1",
  "source": {
    "page_id": "01j4w4j6v2v4p84n8v7v60m0s7",
    "version_id": "01j4w4j7mr6c9s7cezz9n5f2qp",
    "visit_id": "01j4w4j0k7hm9j9tx3jz8s2n5q",
    "canonical_url": "https://example.org/docs/",
    "collection": "default",
    "visibility": "internal",
    "source_kind": "live_web",
    "retrieved_at": "2026-08-09T12:00:01Z"
  },
  "content": {
    "markdown_artifact": {
      "artifact_id": "01j4w4j8v3wx04ssprfy0dnt80",
      "kind": "page_markdown",
      "sha256": "2222222222222222222222222222222222222222222222222222222222222222",
      "mime_type": "text/markdown",
      "size_bytes": 1234,
      "relative_path": "pages/example.org/01j4w4j6v2v4p84n8v7v60m0s7/versions/01j4w4j7mr6c9s7cezz9n5f2qp/page.md",
      "visibility": "internal"
    },
    "title": "Example documentation",
    "language": "en",
    "content_sha256": "3333333333333333333333333333333333333333333333333333333333333333"
  },
  "provenance": {
    "sanitizer_version": "webx-sanitize/1",
    "normalizer_version": "webx-normalize/1",
    "extractor_chain": [
      "trafilatura"
    ],
    "source_artifact_ids": [
      "01j4w4j8gv95v1x2n7e1ss6q61"
    ],
    "trust": "untrusted_external_source"
  },
  "created_at": "2026-08-09T12:00:02Z",
  "extensions": {}
}
